[
  {
    "id": "ttp_ai_visual_memes",
    "label": "AI visual meme production",
    "phase": "production",
    "description": "AI-generated or AI-assisted short visual content with Lego-like or pop-cultural framing.",
    "detection_hints": [
      "lego-style visuals",
      "high-volume variants",
      "short song/parody format"
    ]
  },
  {
    "id": "ttp_emotional_mockery",
    "label": "Humor, ridicule and humiliation framing",
    "phase": "narrative",
    "description": "Emotional framing that makes adversaries appear weak, corrupt or absurd.",
    "detection_hints": [
      "mocking title",
      "diss track",
      "humiliation language"
    ]
  },
  {
    "id": "ttp_cross_platform_seeding",
    "label": "Cross-platform seeding",
    "phase": "distribution",
    "description": "Publishing or resharing across Telegram, X, Instagram, TikTok, YouTube and news mirrors.",
    "detection_hints": [
      "same title across platforms",
      "same source family",
      "multiple source_kind roles"
    ]
  },
  {
    "id": "ttp_mirror_reupload",
    "label": "Mirror / reupload persistence",
    "phase": "distribution",
    "description": "Content survives takedowns through mirrors, reposts or source-page variants.",
    "detection_hints": [
      "mirror role",
      "canonical variant",
      "platform_removed flag"
    ]
  },
  {
    "id": "ttp_amplifier_repost",
    "label": "Amplifier reposting",
    "phase": "amplification",
    "description": "Community or influencer accounts amplify the same or similar content.",
    "detection_hints": [
      "repost role",
      "community family",
      "same canonical group"
    ]
  },
  {
    "id": "ttp_news_coverage_leverage",
    "label": "Coverage leverage",
    "phase": "amplification",
    "description": "Earned media coverage increases awareness and reframes the campaign for broader audiences.",
    "detection_hints": [
      "coverage role",
      "news domains",
      "analysis outlets"
    ]
  },
  {
    "id": "ttp_source_obfuscation",
    "label": "Source ambiguity",
    "phase": "infrastructure",
    "description": "Unclear relationship between production groups, state media, proxies or community mirrors.",
    "detection_hints": [
      "needs_review family",
      "candidate source",
      "low confidence"
    ]
  },
  {
    "id": "ttp_rapid_event_response",
    "label": "Rapid event-response content",
    "phase": "production",
    "description": "Fast content variants tied to breaking events or new political claims.",
    "detection_hints": [
      "recent first_seen_at",
      "event-specific title",
      "candidate queue"
    ]
  },
  {
    "id": "ttp_language_bridging",
    "label": "Language/audience bridging",
    "phase": "distribution",
    "description": "Use of English, captions, rap or Western pop-culture references for non-domestic audiences.",
    "detection_hints": [
      "English-language meta",
      "Western pop references",
      "international coverage"
    ]
  },
  {
    "id": "ttp_review_risk",
    "label": "Human-review dependency",
    "phase": "governance",
    "description": "Analyst review is required because automated labels may overstate origin, intent or authenticity.",
    "detection_hints": [
      "pending_review",
      "needs_more_evidence",
      "needs_verification"
    ]
  }
]
